{
  "$schema":"https://json-schema.org/draft/2020-12/schema",
  "$id":"bopen://schemas/governance/schedule-register/0.1.0-draft",
  "status":"draft","title":"bOPEN Schedule Register","type":"object",
  "required":["$schema","register_id","version","status","owner_authority","updated_at","entries"],
  "properties":{"$schema":{"const":"bopen://schemas/governance/schedule-register/0.1.0-draft"},"register_id":{"type":"string","pattern":"^PG-REG-SCHEDULE-[0-9]{3}$"},"version":{"type":"string","pattern":"^[0-9]+\\.[0-9]+\\.[0-9]+(?:-draft)?$"},"status":{"enum":["draft","approved"]},"owner_authority":{"type":"string","minLength":1},"updated_at":{"type":"string","format":"date-time"},"approved_by":{"type":["string","null"],"minLength":1},"approved_at":{"type":["string","null"],"format":"date-time"},"approval_ref":{"type":["string","null"],"minLength":1},"entries":{"type":"array","minItems":7,"items":{"type":"object","required":["schedule_id","phase_id","title","status","depends_on","owner_authority","work_item_refs","planned_start","planned_end","rebaseline_decision_ref","evidence_refs"],"properties":{"schedule_id":{"type":"string","pattern":"^PG-(?:G|P|C)[0-9]+$"},"phase_id":{"type":"string","pattern":"^PG-(?:G|P|C)[0-9]+$"},"title":{"type":"string","minLength":1},"status":{"enum":["NOT_READY","READY_FOR_AUTHORITY_REVIEW","AUTHORIZED","ACTIVE","COMPLETE","BLOCKED"]},"depends_on":{"type":"array","items":{"type":"string","pattern":"^PG-(?:G|P|C)[0-9]+$"},"uniqueItems":true},"owner_authority":{"type":"string","minLength":1},"work_item_refs":{"type":"array","items":{"type":"string","minLength":1},"uniqueItems":true},"planned_start":{"type":["string","null"],"format":"date-time"},"planned_end":{"type":["string","null"],"format":"date-time"},"rebaseline_decision_ref":{"type":["string","null"]},"evidence_refs":{"type":"array","items":{"type":"string","minLength":1},"uniqueItems":true}},"additionalProperties":false}}},
  "additionalProperties":false
}
