{
  "$schema": "bopen://schemas/governance/schedule-register/0.1.0-draft",
  "register_id": "PG-REG-SCHEDULE-001",
  "version": "0.1.0",
  "status": "approved",
  "owner_authority": "Product Authority",
  "updated_at": "2026-07-24T01:15:27+07:00",
  "approved_by": "HUMAN-OPERATOR-001",
  "approved_at": "2026-07-23T00:45:00+07:00",
  "approval_ref": "docs/00-governance/signing/SIGNING-PASS-2.md#append-only-batch-2-signing-record--2026-07-23",
  "entries": [
    {"schedule_id":"PG-G0","phase_id":"PG-G0","title":"Governance Bootstrap","status":"COMPLETE","depends_on":[],"owner_authority":"Product Authority","work_item_refs":[],"planned_start":"2026-07-23T00:45:00+07:00","planned_end":"2026-07-24T00:20:36+07:00","rebaseline_decision_ref":"docs/00-governance/signing/SIGNING-PASS-4.md#signed-gate-decision","evidence_refs":["docs/00-governance/signing/SIGNING-PASS-4.md","docs/evidence/EVD-GOV-015-docket-v04-remediation-v3-acceptance.md"]},
    {"schedule_id":"PG-P0","phase_id":"PG-P0","title":"Platform Skeleton","status":"COMPLETE","depends_on":["PG-G0"],"owner_authority":"Architecture Authority","work_item_refs":["SKEL-P0-01"],"planned_start":"2026-07-24T01:15:27+07:00","planned_end":"2026-07-27T00:00:00+07:00","rebaseline_decision_ref":"docs/00-governance/signing/PG-P0-CLOSURE-MANDATE.md#signed-decision","evidence_refs":["docs/00-governance/signing/PG-P0-CLOSURE-MANDATE.md","docs/00-governance/signing/SIGNING-PASS-10.md","docs/00-governance/signing/SIGNING-PASS-8.md"]},
    {"schedule_id":"PG-P1","phase_id":"PG-P1","title":"Core Multi-Tenant Kernel","status":"NOT_READY","depends_on":["PG-P0"],"owner_authority":"Architecture Authority","work_item_refs":[],"planned_start":null,"planned_end":null,"rebaseline_decision_ref":null,"evidence_refs":[]},
    {"schedule_id":"PG-P2","phase_id":"PG-P2","title":"Module Platform","status":"NOT_READY","depends_on":["PG-P1"],"owner_authority":"Architecture Authority","work_item_refs":[],"planned_start":null,"planned_end":null,"rebaseline_decision_ref":null,"evidence_refs":[]},
    {"schedule_id":"PG-P3","phase_id":"PG-P3","title":"Common Business Foundation","status":"NOT_READY","depends_on":["PG-P2"],"owner_authority":"Product Authority","work_item_refs":[],"planned_start":null,"planned_end":null,"rebaseline_decision_ref":null,"evidence_refs":[]},
    {"schedule_id":"PG-P4","phase_id":"PG-P4","title":"Reference Product","status":"NOT_READY","depends_on":["PG-P3"],"owner_authority":"Product Authority","work_item_refs":[],"planned_start":null,"planned_end":null,"rebaseline_decision_ref":null,"evidence_refs":[]},
    {"schedule_id":"PG-C0","phase_id":"PG-C0","title":"Conformance","status":"NOT_READY","depends_on":["PG-P4"],"owner_authority":"Engineering Authority","work_item_refs":[],"planned_start":null,"planned_end":null,"rebaseline_decision_ref":null,"evidence_refs":[]}
  ]
}
